coverage_type,category,coverage_score,product1_name,product1_url,product1_price,product1_rating,product2_name,product2_url,product2_price,product2_rating,product1_reviews,product2_reviews,price_difference,rating_difference,price_difference_pct,rating_difference_pct
price_coverage,Mirrors,1.3,"Unknown1 36"" Large Round Natural Wood Wall Mirror W Decorative Beads 36 X 2 36round Brown Rustic",${env.wa_shopping_url}unknown1-36-large-round-natural-wood-wall-mirror-w-decorative-beads-36-x-2-36round-brown-rustic.html,311.25,100,Safavieh Home Madilyn Champagne Sunburst 36-inch Decorative Accent Mirror,${env.wa_shopping_url}safavieh-home-madilyn-champagne-sunburst-36-inch-decorative-accent-mirror.html,87.97,100,1,2,223.28,0,0.7173654618473896,0.0
price_coverage,Mirrors,1.3,"Unknown1 36"" Large Round Natural Wood Wall Mirror W Decorative Beads 36 X 2 36round Brown Rustic",${env.wa_shopping_url}unknown1-36-large-round-natural-wood-wall-mirror-w-decorative-beads-36-x-2-36round-brown-rustic.html,311.25,100,"EMAISON Gold Hanging Mirror with Chain, 12 x 16 Inch Rustic Wall Decor for Bathroom, Entry, Dining Room, and Living Room. Metal Circle Mirror for Wall, Vanity Mirror, Large Decorative Mirror.",${env.wa_shopping_url}emaison-gold-hanging-mirror-with-chain-12-x-16-inch-rustic-wall-decor-for-bathroom-entry-dining-room-and-living-room-metal-circle-mirror-for-wall-vanity-mirror-large-decorative-mirror.html,26.95,100,1,1,284.3,0,0.9134136546184739,0.0
price_coverage,Mirrors,1.3,"Unknown1 36"" Large Round Natural Wood Wall Mirror W Decorative Beads 36 X 2 36round Brown Rustic",${env.wa_shopping_url}unknown1-36-large-round-natural-wood-wall-mirror-w-decorative-beads-36-x-2-36round-brown-rustic.html,311.25,100,"Touch of Class Traditional Hansa Acanthus Leaf Shaped Wall Mirror - Aged Gold - Vintage, Framed Ornate Design, Unique Victorian Aesthetic - Decorative Mirrors for Bedroom, Bathroom - 26"" W x 40"" H",${env.wa_shopping_url}touch-of-class-traditional-hansa-acanthus-leaf-shaped-wall-mirror-aged-gold-vintage-framed-ornate-design-unique-victorian-aesthetic-decorative-mirrors-for-bedroom-bathroom-26-w-x-40-h.html,189.0,100,1,1,122.25,0,0.3927710843373494,0.0
price_coverage,Mirrors,1.3,"Unknown1 36"" Large Round Natural Wood Wall Mirror W Decorative Beads 36 X 2 36round Brown Rustic",${env.wa_shopping_url}unknown1-36-large-round-natural-wood-wall-mirror-w-decorative-beads-36-x-2-36round-brown-rustic.html,311.25,100,"Pinnacle Frames & Accents Kimberly Natural Wood Modern Octagon, 40"" x 40"" Wall Mirror, Brown",${env.wa_shopping_url}pinnacle-frames-accents-kimberly-natural-wood-modern-octagon-40-x-40-wall-mirror-brown.html,119.99,100,1,1,191.26,0,0.6144899598393574,0.0
price_coverage,Mirrors,1.3,"The Hillman Group 122200 Mirror Rosettes, Clear",${env.wa_shopping_url}the-hillman-group-122200-mirror-rosettes-clear.html,9.58,85,"ANDY STAR Bathroom Mirror for Wall, Wall Mounted Mirror 24x36x2 Inch Black Wood Deep Frame, Clean Floating Panel Hangs Horizontal or Vertical for Bathroom Vanity, Living Room, Bedroom",${env.wa_shopping_url}andy-star-bathroom-mirror-for-wall-wall-mounted-mirror-24x36x2-inch-black-wood-deep-frame-clean-floating-panel-hangs-horizontal-or-vertical-for-bathroom-vanity-living-room-bedroom.html,28.36,85,11,12,18.78,0,0.6622002820874472,0.0
price_coverage,Mirrors,1.3,"Hamilton Hills Contemporary Brushed Metal Wall Mirror | Glass Panel Gold Framed Rounded Corner Deep Set Design | Mirrored Rectangle Hangs Horizontal or Vertical (24"" x 36"")",${env.wa_shopping_url}hamilton-hills-contemporary-brushed-metal-wall-mirror-glass-panel-gold-framed-rounded-corner-deep-set-design-mirrored-rectangle-hangs-horizontal-or-vertical-24-x-36.html,199.99,80,"Kate and Laurel Hogan 9 Windowpane Wood Wall Mirror, Rustic Caramel 26x32",${env.wa_shopping_url}kate-and-laurel-hogan-9-windowpane-wood-wall-mirror-rustic-caramel-26x32.html,10.9,80,12,12,189.09,0,0.9454972748637431,0.0
price_coverage,Mirrors,1.3,KOHROS Rectangular Decorative Wall Mirror-Solid Silver Stone Accented Large Antique Venetian Wall Mirror for Entryways/ Living Room/ Bathroom 23.6 x 35.4,${env.wa_shopping_url}kohros-rectangular-decorative-wall-mirror-solid-silver-stone-accented-large-antique-venetian-wall-mirror-for-entryways-living-room-bathroom-23-6-x-35-4.html,144.89,100,Safavieh Home Madilyn Champagne Sunburst 36-inch Decorative Accent Mirror,${env.wa_shopping_url}safavieh-home-madilyn-champagne-sunburst-36-inch-decorative-accent-mirror.html,87.97,100,4,2,56.91999999999999,0,0.3928497480847539,0.0
price_coverage,Mirrors,1.3,KOHROS Rectangular Decorative Wall Mirror-Solid Silver Stone Accented Large Antique Venetian Wall Mirror for Entryways/ Living Room/ Bathroom 23.6 x 35.4,${env.wa_shopping_url}kohros-rectangular-decorative-wall-mirror-solid-silver-stone-accented-large-antique-venetian-wall-mirror-for-entryways-living-room-bathroom-23-6-x-35-4.html,144.89,100,"EMAISON Gold Hanging Mirror with Chain, 12 x 16 Inch Rustic Wall Decor for Bathroom, Entry, Dining Room, and Living Room. Metal Circle Mirror for Wall, Vanity Mirror, Large Decorative Mirror.",${env.wa_shopping_url}emaison-gold-hanging-mirror-with-chain-12-x-16-inch-rustic-wall-decor-for-bathroom-entry-dining-room-and-living-room-metal-circle-mirror-for-wall-vanity-mirror-large-decorative-mirror.html,26.95,100,4,1,117.93999999999998,0,0.813996825177721,0.0
price_coverage,Mirrors,1.3,KOHROS Rectangular Decorative Wall Mirror-Solid Silver Stone Accented Large Antique Venetian Wall Mirror for Entryways/ Living Room/ Bathroom 23.6 x 35.4,${env.wa_shopping_url}kohros-rectangular-decorative-wall-mirror-solid-silver-stone-accented-large-antique-venetian-wall-mirror-for-entryways-living-room-bathroom-23-6-x-35-4.html,144.89,100,"Touch of Class Traditional Hansa Acanthus Leaf Shaped Wall Mirror - Aged Gold - Vintage, Framed Ornate Design, Unique Victorian Aesthetic - Decorative Mirrors for Bedroom, Bathroom - 26"" W x 40"" H",${env.wa_shopping_url}touch-of-class-traditional-hansa-acanthus-leaf-shaped-wall-mirror-aged-gold-vintage-framed-ornate-design-unique-victorian-aesthetic-decorative-mirrors-for-bedroom-bathroom-26-w-x-40-h.html,189.0,100,4,1,44.110000000000014,0,0.23338624338624345,0.0
price_coverage,Mirrors,1.3,KOHROS Rectangular Decorative Wall Mirror-Solid Silver Stone Accented Large Antique Venetian Wall Mirror for Entryways/ Living Room/ Bathroom 23.6 x 35.4,${env.wa_shopping_url}kohros-rectangular-decorative-wall-mirror-solid-silver-stone-accented-large-antique-venetian-wall-mirror-for-entryways-living-room-bathroom-23-6-x-35-4.html,144.89,100,"Pinnacle Frames & Accents Kimberly Natural Wood Modern Octagon, 40"" x 40"" Wall Mirror, Brown",${env.wa_shopping_url}pinnacle-frames-accents-kimberly-natural-wood-modern-octagon-40-x-40-wall-mirror-brown.html,119.99,100,4,1,24.89999999999999,0,0.17185451031817237,0.0
price_coverage,Mirrors,1.3,Evil Eye Wall Mirrors Decorative Metal Mirrors Gold Mirror with Tassels Great Wall Art for Bathroom Bedroom Living Room (Large -1),${env.wa_shopping_url}evil-eye-wall-mirrors-decorative-metal-mirrors-gold-mirror-with-tassels-great-wall-art-for-bathroom-bedroom-living-room-large-1.html,23.69,60,"Retro Metal Wall Hanging Mirror with Hemp Rope Round Decorative Bathroom Mirrors Creative Makeup Shaving Iron Mirrors Large (Color : Black, Size : 80cm)",${env.wa_shopping_url}retro-metal-wall-hanging-mirror-with-hemp-rope-round-decorative-bathroom-mirrors-creative-makeup-shaving-iron-mirrors-large-color-black-size-80cm.html,159.99,60,3,1,136.3,0,0.8519282455153447,0.0
price_coverage,Mirrors,1.3,Safavieh Home Madilyn Champagne Sunburst 36-inch Decorative Accent Mirror,${env.wa_shopping_url}safavieh-home-madilyn-champagne-sunburst-36-inch-decorative-accent-mirror.html,87.97,100,"EMAISON Gold Hanging Mirror with Chain, 12 x 16 Inch Rustic Wall Decor for Bathroom, Entry, Dining Room, and Living Room. Metal Circle Mirror for Wall, Vanity Mirror, Large Decorative Mirror.",${env.wa_shopping_url}emaison-gold-hanging-mirror-with-chain-12-x-16-inch-rustic-wall-decor-for-bathroom-entry-dining-room-and-living-room-metal-circle-mirror-for-wall-vanity-mirror-large-decorative-mirror.html,26.95,100,2,1,61.019999999999996,0,0.6936455609866999,0.0
price_coverage,Mirrors,1.3,Safavieh Home Madilyn Champagne Sunburst 36-inch Decorative Accent Mirror,${env.wa_shopping_url}safavieh-home-madilyn-champagne-sunburst-36-inch-decorative-accent-mirror.html,87.97,100,"Touch of Class Traditional Hansa Acanthus Leaf Shaped Wall Mirror - Aged Gold - Vintage, Framed Ornate Design, Unique Victorian Aesthetic - Decorative Mirrors for Bedroom, Bathroom - 26"" W x 40"" H",${env.wa_shopping_url}touch-of-class-traditional-hansa-acanthus-leaf-shaped-wall-mirror-aged-gold-vintage-framed-ornate-design-unique-victorian-aesthetic-decorative-mirrors-for-bedroom-bathroom-26-w-x-40-h.html,189.0,100,2,1,101.03,0,0.5345502645502646,0.0
price_coverage,Mirrors,1.3,Safavieh Home Madilyn Champagne Sunburst 36-inch Decorative Accent Mirror,${env.wa_shopping_url}safavieh-home-madilyn-champagne-sunburst-36-inch-decorative-accent-mirror.html,87.97,100,"Pinnacle Frames & Accents Kimberly Natural Wood Modern Octagon, 40"" x 40"" Wall Mirror, Brown",${env.wa_shopping_url}pinnacle-frames-accents-kimberly-natural-wood-modern-octagon-40-x-40-wall-mirror-brown.html,119.99,100,2,1,32.019999999999996,0,0.2668555712976081,0.0
price_coverage,Mirrors,1.3,"EMAISON Gold Hanging Mirror with Chain, 12 x 16 Inch Rustic Wall Decor for Bathroom, Entry, Dining Room, and Living Room. Metal Circle Mirror for Wall, Vanity Mirror, Large Decorative Mirror.",${env.wa_shopping_url}emaison-gold-hanging-mirror-with-chain-12-x-16-inch-rustic-wall-decor-for-bathroom-entry-dining-room-and-living-room-metal-circle-mirror-for-wall-vanity-mirror-large-decorative-mirror.html,26.95,100,"Touch of Class Traditional Hansa Acanthus Leaf Shaped Wall Mirror - Aged Gold - Vintage, Framed Ornate Design, Unique Victorian Aesthetic - Decorative Mirrors for Bedroom, Bathroom - 26"" W x 40"" H",${env.wa_shopping_url}touch-of-class-traditional-hansa-acanthus-leaf-shaped-wall-mirror-aged-gold-vintage-framed-ornate-design-unique-victorian-aesthetic-decorative-mirrors-for-bedroom-bathroom-26-w-x-40-h.html,189.0,100,1,1,162.05,0,0.8574074074074075,0.0
price_coverage,Mirrors,1.3,"EMAISON Gold Hanging Mirror with Chain, 12 x 16 Inch Rustic Wall Decor for Bathroom, Entry, Dining Room, and Living Room. Metal Circle Mirror for Wall, Vanity Mirror, Large Decorative Mirror.",${env.wa_shopping_url}emaison-gold-hanging-mirror-with-chain-12-x-16-inch-rustic-wall-decor-for-bathroom-entry-dining-room-and-living-room-metal-circle-mirror-for-wall-vanity-mirror-large-decorative-mirror.html,26.95,100,"Pinnacle Frames & Accents Kimberly Natural Wood Modern Octagon, 40"" x 40"" Wall Mirror, Brown",${env.wa_shopping_url}pinnacle-frames-accents-kimberly-natural-wood-modern-octagon-40-x-40-wall-mirror-brown.html,119.99,100,1,1,93.03999999999999,0,0.7753979498291524,0.0
price_coverage,Mirrors,1.3,"Touch of Class Traditional Hansa Acanthus Leaf Shaped Wall Mirror - Aged Gold - Vintage, Framed Ornate Design, Unique Victorian Aesthetic - Decorative Mirrors for Bedroom, Bathroom - 26"" W x 40"" H",${env.wa_shopping_url}touch-of-class-traditional-hansa-acanthus-leaf-shaped-wall-mirror-aged-gold-vintage-framed-ornate-design-unique-victorian-aesthetic-decorative-mirrors-for-bedroom-bathroom-26-w-x-40-h.html,189.0,100,"Pinnacle Frames & Accents Kimberly Natural Wood Modern Octagon, 40"" x 40"" Wall Mirror, Brown",${env.wa_shopping_url}pinnacle-frames-accents-kimberly-natural-wood-modern-octagon-40-x-40-wall-mirror-brown.html,119.99,100,1,1,69.01,0,0.36513227513227514,0.0
price_coverage,Digital Cameras,1.2000000000000002,Panasonic LUMIX DMC-FZ20 5 Megapixel Digital Camera ( Silver ),${env.wa_shopping_url}panasonic-lumix-dmc-fz20-5-megapixel-digital-camera-silver.html,95.0,80,Nikon 1 J3 14.2 MP HD Digital Camera Body Only (White) (Certified Refurbished),${env.wa_shopping_url}nikon-1-j3-14-2-mp-hd-digital-camera-body-only-white-certified-refurbished.html,228.99,80,2,1,133.99,0,0.5851347220402637,0.0
price_coverage,Digital Cameras,1.2000000000000002,Panasonic LUMIX DMC-FZ20 5 Megapixel Digital Camera ( Silver ),${env.wa_shopping_url}panasonic-lumix-dmc-fz20-5-megapixel-digital-camera-silver.html,95.0,80,Canon EOS 6D Mark II Wi-Fi Digital SLR Camera Body with BG-E21 Battery Grip,${env.wa_shopping_url}canon-eos-6d-mark-ii-wi-fi-digital-slr-camera-body-with-bg-e21-battery-grip.html,1469.95,80,2,12,1374.95,0,0.9353719514269193,0.0
price_coverage,Digital Cameras,1.2000000000000002,General Imaging X450 Digital Camera with 2.7-Inch LCD GE PowerPro 16MP 25X Optical Zoom HD Video SLR-Style Camera (Color- White/Black/RED/Purple/Blue/Gold) (Blue),${env.wa_shopping_url}general-imaging-x450-digital-camera-with-2-7-inch-lcd-ge-powerpro-16mp-25x-optical-zoom-hd-video-slr-style-camera-color-white-black-red-purple-blue-gold-blue.html,139.0,92,"Canon Cameras US 24.2MP Digital SLR Camera Bundle with 3"" LCD, Black (1894C021)",${env.wa_shopping_url}canon-cameras-us-24-2mp-digital-slr-camera-bundle-with-3-lcd-black-1894c021.html,1299.0,92,5,12,1160.0,0,0.8929946112394149,0.0
price_coverage,Digital Cameras,1.2000000000000002,"Vlogging Camera, 4K Digital Camera for YouTube with WiFi, 16X Digital Zoom top1o Zoom, 180 Degree Flip Screen, Wide Angle Lens, Macro Lens, 2 Batteries and 32GB TF Card",${env.wa_shopping_url}vlogging-camera-4k-digital-camera-for-youtube-with-wifi-16x-digital-zoom-top1o-zoom-180-degree-flip-screen-wide-angle-lens-macro-lens-2-batteries-and-32gb-tf-card.html,139.98,100,Canon EOS M50 Mirrorless Digital Camera with 15-45mm Lens + Flexible Tripod + UV Protection Filter + Professional Case + Card Reader - International Version Kit,${env.wa_shopping_url}canon-eos-m50-mirrorless-digital-camera-with-15-45mm-lens-flexible-tripod-uv-protection-filter-professional-case-card-reader-international-version-kit.html,969.0,100,1,2,829.02,0,0.8555417956656347,0.0
price_coverage,Digital Cameras,1.2000000000000002,"Vlogging Camera, 4K Digital Camera for YouTube with WiFi, 16X Digital Zoom top1o Zoom, 180 Degree Flip Screen, Wide Angle Lens, Macro Lens, 2 Batteries and 32GB TF Card",${env.wa_shopping_url}vlogging-camera-4k-digital-camera-for-youtube-with-wifi-16x-digital-zoom-top1o-zoom-180-degree-flip-screen-wide-angle-lens-macro-lens-2-batteries-and-32gb-tf-card.html,139.98,100,Sony Alpha A7 II Digital Camera & 28-70mm FE OSS Lens with 64GB Card + Case + Battery & Charger + Tripod + Tele/Wide Lens Kit,${env.wa_shopping_url}sony-alpha-a7-ii-digital-camera-28-70mm-fe-oss-lens-with-64gb-card-case-battery-charger-tripod-tele-wide-lens-kit.html,1618.0,100,1,2,1478.02,0,0.9134857849196539,0.0
price_coverage,Digital Cameras,1.2000000000000002,Nikon 1 J3 14.2 MP HD Digital Camera Body Only (White) (Certified Refurbished),${env.wa_shopping_url}nikon-1-j3-14-2-mp-hd-digital-camera-body-only-white-certified-refurbished.html,228.99,80,Canon EOS 6D Mark II Wi-Fi Digital SLR Camera Body with BG-E21 Battery Grip,${env.wa_shopping_url}canon-eos-6d-mark-ii-wi-fi-digital-slr-camera-body-with-bg-e21-battery-grip.html,1469.95,80,1,12,1240.96,0,0.8442191911289499,0.0
price_coverage,Digital Cameras,1.2000000000000002,Sony Alpha a6000 Camera with 55-210mm and 16-50mm Power Zoom Lenses - Includes Camera with 16-50mm Power Zoom Lens and 55-210mm Zoom Lens (Silver),${env.wa_shopping_url}sony-alpha-a6000-camera-with-55-210mm-and-16-50mm-power-zoom-lenses-includes-camera-with-16-50mm-power-zoom-lens-and-55-210mm-zoom-lens-silver.html,899.0,73,Renewed Nikon D7500 DX DSLR Camera Body,${env.wa_shopping_url}renewed-nikon-d7500-dx-dslr-camera-body.html,988.0,73,3,12,89.0,0,0.09008097165991903,0.0
price_coverage,Digital Cameras,1.2000000000000002,Canon EOS M50 Mirrorless Digital Camera with 15-45mm Lens + Flexible Tripod + UV Protection Filter + Professional Case + Card Reader - International Version Kit,${env.wa_shopping_url}canon-eos-m50-mirrorless-digital-camera-with-15-45mm-lens-flexible-tripod-uv-protection-filter-professional-case-card-reader-international-version-kit.html,969.0,100,Sony Alpha A7 II Digital Camera & 28-70mm FE OSS Lens with 64GB Card + Case + Battery & Charger + Tripod + Tele/Wide Lens Kit,${env.wa_shopping_url}sony-alpha-a7-ii-digital-camera-28-70mm-fe-oss-lens-with-64gb-card-case-battery-charger-tripod-tele-wide-lens-kit.html,1618.0,100,2,2,649.0,0,0.4011124845488257,0.0
price_coverage,Video Projectors,1.2000000000000002,"LG HU70LA 4K UHD Smart Home Theater CineBeam Projector with Alexa Built-in, LG ThinQ AI, Google Assistant, and LG webOS Lite Smart TV (Netflix, and VUDU) (Renewed)",${env.wa_shopping_url}lg-hu70la-4k-uhd-smart-home-theater-cinebeam-projector-with-alexa-built-in-lg-thinq-ai-google-assistant-and-lg-webos-lite-smart-tv-netflix-and-vudu-renewed.html,5.21,60,"Kaya Projector, Xiaomi 1S 4K Projector MJJGTYDS04FM | Ultra Short Throw | ALPD 3.0 | Android 3D Home Cinema Projector - Updated Version",${env.wa_shopping_url}kaya-projector-xiaomi-1s-4k-projector-mjjgtyds04fm-ultra-short-throw-alpd-3-0-android-3d-home-cinema-projector-updated-version.html,2390.0,60,3,2,2384.79,0,0.9978200836820084,0.0
price_coverage,Video Projectors,1.2000000000000002,ViewSonic PJL6233 30-Inch 1080i Front Projector (Black),${env.wa_shopping_url}viewsonic-pjl6233-30-inch-1080i-front-projector-black.html,57.04,100,Epson POWERLITE 475W PowerLite 475W Multimedia Projector,${env.wa_shopping_url}epson-powerlite-475w-powerlite-475w-multimedia-projector.html,458.0,100,1,2,400.96,0,0.8754585152838428,0.0
price_coverage,Video Projectors,1.2000000000000002,ViewSonic PJL6233 30-Inch 1080i Front Projector (Black),${env.wa_shopping_url}viewsonic-pjl6233-30-inch-1080i-front-projector-black.html,57.04,100,Mitsubishi  DLP Projector (XD90U),${env.wa_shopping_url}mitsubishi-dlp-projector-xd90u.html,599.95,100,1,1,542.9100000000001,0,0.9049254104508709,0.0
price_coverage,Video Projectors,1.2000000000000002,ViewSonic PJL6233 30-Inch 1080i Front Projector (Black),${env.wa_shopping_url}viewsonic-pjl6233-30-inch-1080i-front-projector-black.html,57.04,100,Epson PowerLite 109W LCD Projector - 16:10,${env.wa_shopping_url}epson-powerlite-109w-lcd-projector-16-10.html,815.92,100,1,1,758.88,0,0.9300911854103344,0.0
price_coverage,Video Projectors,1.2000000000000002,ViewSonic PJL6233 30-Inch 1080i Front Projector (Black),${env.wa_shopping_url}viewsonic-pjl6233-30-inch-1080i-front-projector-black.html,57.04,100,BenQ MU686 High Brightness Low Noise Business Projector with WUXGA for Wireless Presentation Projector,${env.wa_shopping_url}benq-mu686-high-brightness-low-noise-business-projector-with-wuxga-for-wireless-presentation-projector.html,869.99,100,1,1,812.95,0,0.9344360280003219,0.0
price_coverage,Video Projectors,1.2000000000000002,ViewSonic PJL6233 30-Inch 1080i Front Projector (Black),${env.wa_shopping_url}viewsonic-pjl6233-30-inch-1080i-front-projector-black.html,57.04,100,BenQ SX920 DLP Projector,${env.wa_shopping_url}benq-sx920-dlp-projector.html,1199.99,100,1,1,1142.95,0,0.9524662705522546,0.0
price_coverage,Video Projectors,1.2000000000000002,ViewSonic PJL6233 30-Inch 1080i Front Projector (Black),${env.wa_shopping_url}viewsonic-pjl6233-30-inch-1080i-front-projector-black.html,57.04,100,"Optoma UHL55 Portable LED UHD 4K Smart Projector,Compatible with Alexa - (Renewed)",${env.wa_shopping_url}optoma-uhl55-portable-led-uhd-4k-smart-projector-compatible-with-alexa-renewed.html,1790.0,100,1,3,1732.96,0,0.9681340782122905,0.0
price_coverage,Video Projectors,1.2000000000000002,NEC NP64 3000 Lumens XGA DLP Projector,${env.wa_shopping_url}nec-np64-3000-lumens-xga-dlp-projector.html,150.0,80,"InFocus IN114 Portable DLP Projector, 3D ready, XGA, 2700 Lumens",${env.wa_shopping_url}infocus-in114-portable-dlp-projector-3d-ready-xga-2700-lumens.html,498.0,80,3,12,348.0,0,0.6987951807228916,0.0
price_coverage,Video Projectors,1.2000000000000002,"Native 1080P 5G WiFi Bluetooth Projector, Roconia 9000LM Full HD Movie Projector, 300"" Display for Outdoor Movies Support 4k Home Theater,Compatible with iOS/Android/PC/XBox/PS4/TV Stick/HDMI/USB",${env.wa_shopping_url}native-1080p-5g-wifi-bluetooth-projector-roconia-9000lm-full-hd-movie-projector-300-display-for-outdoor-movies-support-4k-home-theater-compatible-with-ios-android-pc-xbox-ps4-tv-stick-hdmi-usb.html,219.98,93,NEC NP-M311W Projector,${env.wa_shopping_url}nec-np-m311w-projector.html,642.77,93,12,4,422.78999999999996,0,0.6577624966939962,0.0
price_coverage,Video Projectors,1.2000000000000002,Epson PowerLite 585W LCD Projector - HDTV - 16:10,${env.wa_shopping_url}epson-powerlite-585w-lcd-projector-hdtv-16-10.html,399.99,73,"ViewSonic PJD6345 XGA 1024x768 DLP Projector with LAN Control, Wired and Wireless LAN Display (Black)",${env.wa_shopping_url}viewsonic-pjd6345-xga-1024x768-dlp-projector-with-lan-control-wired-and-wireless-lan-display-black.html,764.1,73,3,8,364.11,0,0.47652139772281116,0.0
price_coverage,Video Projectors,1.2000000000000002,Epson PowerLite 585W LCD Projector - HDTV - 16:10,${env.wa_shopping_url}epson-powerlite-585w-lcd-projector-hdtv-16-10.html,399.99,73,"BenQ HT5550 True 4K UHD Home Theater Projector with HDR-PRO | 100% DCI-P3 & 100% Rec. 709 for Best Colors | Frame Interpolation for Fluid Picture, Black",${env.wa_shopping_url}benq-ht5550-true-4k-uhd-home-theater-projector-with-hdr-pro-100-dci-p3-100-rec-709-for-best-colors-frame-interpolation-for-fluid-picture-black.html,2661.23,73,3,12,2261.24,0,0.8496973204119899,0.0
price_coverage,Video Projectors,1.2000000000000002,Epson POWERLITE 475W PowerLite 475W Multimedia Projector,${env.wa_shopping_url}epson-powerlite-475w-powerlite-475w-multimedia-projector.html,458.0,100,Mitsubishi  DLP Projector (XD90U),${env.wa_shopping_url}mitsubishi-dlp-projector-xd90u.html,599.95,100,2,1,141.95000000000005,0,0.2366030502541879,0.0
price_coverage,Video Projectors,1.2000000000000002,Epson POWERLITE 475W PowerLite 475W Multimedia Projector,${env.wa_shopping_url}epson-powerlite-475w-powerlite-475w-multimedia-projector.html,458.0,100,Epson PowerLite 109W LCD Projector - 16:10,${env.wa_shopping_url}epson-powerlite-109w-lcd-projector-16-10.html,815.92,100,2,1,357.91999999999996,0,0.4386704578880282,0.0
price_coverage,Video Projectors,1.2000000000000002,Epson POWERLITE 475W PowerLite 475W Multimedia Projector,${env.wa_shopping_url}epson-powerlite-475w-powerlite-475w-multimedia-projector.html,458.0,100,BenQ MU686 High Brightness Low Noise Business Projector with WUXGA for Wireless Presentation Projector,${env.wa_shopping_url}benq-mu686-high-brightness-low-noise-business-projector-with-wuxga-for-wireless-presentation-projector.html,869.99,100,2,1,411.99,0,0.47355716732376235,0.0
price_coverage,Video Projectors,1.2000000000000002,Epson POWERLITE 475W PowerLite 475W Multimedia Projector,${env.wa_shopping_url}epson-powerlite-475w-powerlite-475w-multimedia-projector.html,458.0,100,BenQ SX920 DLP Projector,${env.wa_shopping_url}benq-sx920-dlp-projector.html,1199.99,100,2,1,741.99,0,0.6183301527512729,0.0
price_coverage,Video Projectors,1.2000000000000002,Epson POWERLITE 475W PowerLite 475W Multimedia Projector,${env.wa_shopping_url}epson-powerlite-475w-powerlite-475w-multimedia-projector.html,458.0,100,"Optoma UHL55 Portable LED UHD 4K Smart Projector,Compatible with Alexa - (Renewed)",${env.wa_shopping_url}optoma-uhl55-portable-led-uhd-4k-smart-projector-compatible-with-alexa-renewed.html,1790.0,100,2,3,1332.0,0,0.7441340782122905,0.0
price_coverage,Video Projectors,1.2000000000000002,Mitsubishi  DLP Projector (XD90U),${env.wa_shopping_url}mitsubishi-dlp-projector-xd90u.html,599.95,100,Epson PowerLite 109W LCD Projector - 16:10,${env.wa_shopping_url}epson-powerlite-109w-lcd-projector-16-10.html,815.92,100,1,1,215.9699999999999,0,0.26469506814393556,0.0
price_coverage,Video Projectors,1.2000000000000002,Mitsubishi  DLP Projector (XD90U),${env.wa_shopping_url}mitsubishi-dlp-projector-xd90u.html,599.95,100,BenQ MU686 High Brightness Low Noise Business Projector with WUXGA for Wireless Presentation Projector,${env.wa_shopping_url}benq-mu686-high-brightness-low-noise-business-projector-with-wuxga-for-wireless-presentation-projector.html,869.99,100,1,1,270.03999999999996,0,0.31039437234910744,0.0
price_coverage,Video Projectors,1.2000000000000002,Mitsubishi  DLP Projector (XD90U),${env.wa_shopping_url}mitsubishi-dlp-projector-xd90u.html,599.95,100,BenQ SX920 DLP Projector,${env.wa_shopping_url}benq-sx920-dlp-projector.html,1199.99,100,1,1,600.04,0,0.5000375003125026,0.0
price_coverage,Video Projectors,1.2000000000000002,Mitsubishi  DLP Projector (XD90U),${env.wa_shopping_url}mitsubishi-dlp-projector-xd90u.html,599.95,100,"Optoma UHL55 Portable LED UHD 4K Smart Projector,Compatible with Alexa - (Renewed)",${env.wa_shopping_url}optoma-uhl55-portable-led-uhd-4k-smart-projector-compatible-with-alexa-renewed.html,1790.0,100,1,3,1190.05,0,0.6648324022346368,0.0
price_coverage,Video Projectors,1.2000000000000002,"ViewSonic PJD6345 XGA 1024x768 DLP Projector with LAN Control, Wired and Wireless LAN Display (Black)",${env.wa_shopping_url}viewsonic-pjd6345-xga-1024x768-dlp-projector-with-lan-control-wired-and-wireless-lan-display-black.html,764.1,73,"BenQ HT5550 True 4K UHD Home Theater Projector with HDR-PRO | 100% DCI-P3 & 100% Rec. 709 for Best Colors | Frame Interpolation for Fluid Picture, Black",${env.wa_shopping_url}benq-ht5550-true-4k-uhd-home-theater-projector-with-hdr-pro-100-dci-p3-100-rec-709-for-best-colors-frame-interpolation-for-fluid-picture-black.html,2661.23,73,8,12,1897.13,0,0.71287712824521,0.0
